{
  "blocking_issues": [],
  "criteria_results": [
    {
      "completion_condition": "A project profile and falsifiable prototype hypothesis exist.",
      "created_at": "2025-01-01T00:00:00Z",
      "description": "A project profile and falsifiable prototype hypothesis exist.",
      "evaluated_at": null,
      "evaluation_freshness": {
        "reasons": [],
        "status": "current"
      },
      "evaluation_history": [],
      "evaluation_limitations": [],
      "evaluation_reason": null,
      "id": "MC-001",
      "lifecycle_status": "active",
      "milestone": "Clarify the game idea",
      "milestone_history": [],
      "milestone_id": "MS-0001",
      "related_decisions": [],
      "related_issues": [],
      "required": true,
      "retired_at": null,
      "retirement_reason": null,
      "support_status": "unsupported",
      "supporting_evidence": [],
      "updated_at": "2025-01-01T00:00:00Z",
      "verification_method": "Review the initialized project profile and prototype hypothesis.",
      "verification_policy": "document-review"
    }
  ],
  "milestone": "Clarify the game idea",
  "milestone_id": "MS-0001",
  "milestones": [
    {
      "created_at": "2025-01-01T00:00:00Z",
      "id": "MS-0001",
      "status": "current",
      "title": "Clarify the game idea",
      "updated_at": "2025-01-01T00:00:00Z"
    },
    {
      "created_at": "2025-01-01T00:00:00Z",
      "id": "MS-0002",
      "status": "known",
      "title": "Define the smallest useful prototype",
      "updated_at": "2025-01-01T00:00:00Z"
    }
  ],
  "next_milestone": "Define the smallest useful prototype",
  "next_milestone_id": "MS-0002",
  "recommendation": "Run guided intake before selecting or building a prototype.",
  "schema_version": "3.2",
  "supporting_evidence": [],
  "verdict": "PAUSE"
}
